url,votes,title
https://www.reddit.com/r/EliteDangerous/comments/3om9z6/trading_overwatch_group/,6,Trading Overwatch Group?
https://www.reddit.com/r/EliteDangerous/comments/3on8fj/my_first_and_last_trading_run_rant/,•,My first and last trading run [RANT]
https://www.reddit.com/r/EliteDangerous/comments/3olt8h/definitely_impressed_with_the_new_mining_in_14/,8,"Definitely impressed with the new mining in 1.4, but there's still a few things"
https://youtu.be/ODXvuY1Dp_0,3,Hmm ? What's that noise ?
https://www.reddit.com/r/EliteDangerous/comments/3oh43x/i_love_elite_dangerous_for_a_different_reason/,546,I love Elite Dangerous for a different reason;
https://www.youtube.com/watch?v=4nRxy25LABw,57,Underutilized weapons are the best because nobody is really prepared for them! [PvP - 3 min]
http://imgur.com/gallery/mVCky,18,My quest for the Horsehead Nebula: One day trip to one of the marvels of our galaxy. Decided to take some pictures on the way and I thought you guys might like them!
https://www.reddit.com/r/EliteDangerous/comments/3oni64/how_will_the_new_fringe_smuggling_missions_affect/,•,How will the new Fringe Smuggling missions affect the BGS?
https://www.reddit.com/r/EliteDangerous/comments/3okz7m/i_have_a_question_regarding_player_demographics/,14,I have a question regarding player demographics and game satisfaction.
https://www.reddit.com/r/EliteDangerous/comments/3okuuu/im_at_sag_a_what_now/,14,I'm at Sag A* - what now?
https://www.reddit.com/r/EliteDangerous/comments/3omtks/need_help_with_vulture_settup/,3,need help with vulture settup
https://www.reddit.com/r/EliteDangerous/comments/3omqqu/windows_10_oculus/,3,Windows 10 Oculus
https://www.youtube.com/watch?v=sx6Wz2qMNek,•,Plight of CQC Matchmaking
https://www.reddit.com/r/EliteDangerous/comments/3oje2j/what_the_fuck_is_with_that_creepy_galnet_static/,69,What the fuck is with that creepy Galnet static?
https://www.reddit.com/r/EliteDangerous/comments/3olnmu/have_black_markets_been_made_rarer_in_14/,6,Have black markets been made rarer in 1.4?
https://www.reddit.com/r/EliteDangerous/comments/3omksq/here_is_a_crazy_idea/,3,Here is a crazy idea!
https://www.reddit.com/r/EliteDangerous/comments/3omjrg/do_npcs_have_a_max_scanning_range_and_do/,3,Do NPCs have a max scanning range and do different types of ships have a larger range than others?
https://www.reddit.com/r/EliteDangerous/comments/3om4qs/combat_and_dark_extraction_sites/,4,Combat and Dark Extraction Sites
https://www.reddit.com/r/EliteDangerous/comments/3om3up/14_supercruise_vr_stuttering_nvidia_cards/,4,1.4 Supercruise VR stuttering (nvidia cards)
https://www.reddit.com/r/EliteDangerous/comments/3omu3v/anyone_got_problems_with_the_new_nvidia_driver/,2,Anyone got problems with the new Nvidia driver (358.50)
https://www.reddit.com/r/EliteDangerous/comments/3om87e/xbox_one_issue/,3,[xbox one] issue
https://www.reddit.com/r/EliteDangerous/comments/3ohwi6/system_security_ships_should_have_flashing_lights/,168,System security ships should have flashing lights.
http://imgur.com/tOyRPQ4,•,How can I say no to a reward like that?!
https://www.reddit.com/r/EliteDangerous/comments/3onlw1/requested_stellar_phenomenon/,•,Requested Stellar phenomenon
https://www.reddit.com/r/EliteDangerous/comments/3omnwa/question_about_armor_value/,2,Question about armor value
https://www.reddit.com/r/EliteDangerous/comments/3ommpp/white_dotted_line_along_ring_horizon_in_res/,2,White dotted line along ring horizon in RES
https://www.reddit.com/r/EliteDangerous/comments/3om0ry/with_the_class_4_beam_coming_out_soon_lets_go/,4,"With the Class 4 beam coming out soon, let's go through some features, design and game balance tactics for such a weapon."
https://www.reddit.com/r/EliteDangerous/comments/3onimz/crashing_all_the_time/,•,Crashing all the time
https://www.reddit.com/r/EliteDangerous/comments/3olyqq/multiple_fines_in_same_system_for_same_crime_bug/,3,Multiple Fines in Same System for Same Crime? Bug?
https://www.reddit.com/r/EliteDangerous/comments/3olxxt/beginning_my_bounty_hunting_career_with_a_vulture/,4,"Beginning my Bounty Hunting Career with a Vulture. Looking for a 10-11mil Build, as well as some advice."
https://www.reddit.com/r/EliteDangerous/comments/3oilct/is_there_anyway_i_can_explore_and_have_a_shit/,81,"Is there anyway I can explore and have a shit ""back at home"""
http://www.amazon.com/Microsoft-E13-00001-Sidewinder-Joystick-USB/dp/B00006BA0Q,•,Coincidence?
http://i.imgur.com/LRaqFOu.png,•,Highest single smuggling missions pay out... yet?
https://www.reddit.com/r/EliteDangerous/comments/3omgct/just_lost_half_of_my_credits_after_a_game_crash/,2,Just lost half of my credits after a game crash
https://youtu.be/yLQsHFTFOGE,•,Why does my fuel scoop sound like the laboured breathing of a malignant god?
https://www.reddit.com/r/EliteDangerous/comments/3oik38/how_i_stopped_minmaxing_and_started_having_fun/,77,How I stopped min/maxing and started having fun.
https://www.reddit.com/r/EliteDangerous/comments/3oncre/what_the_hell_is_happening/,•,What the hell is happening?
https://www.reddit.com/r/EliteDangerous/comments/3ombym/starting_a_bounty_hunter_explorer_group_xboxone/,2,Starting a Bounty Hunter/ explorer Group Xboxone
https://www.reddit.com/r/EliteDangerous/comments/3on9gl/best_station_to_get_longrange_missions_at/,•,Best station to get long-range missions at?
https://www.youtube.com/watch?v=SrgpnKhE31A,•,Can we PLEASE have system map similar to this??
http://images.akamai.steamusercontent.com/ugc/386539771688052151/486A6628A70245D68CE40E9354623058CE27AB87/,•,"Are we still doing ""Inside of _____ ship!"" Posts? Inside of a Diamondback"
http://imgur.com/a/7Gb9C,1,I love the industrial design in ED. Wanted to share some screenshots... (4K)
https://www.reddit.com/r/EliteDangerous/comments/3on3kj/give_me_tips_what_to_do/,1,Give me tips what to do!
https://www.reddit.com/r/EliteDangerous/comments/3on3ke/which_faction_and_open_play_help/,2,Which Faction and Open Play [HELP]
http://imgur.com/a/EJLTi,1,"Mining in a Clipper, Bhotho. (Plus a few pics of my new Imperial Eagle)"
https://www.reddit.com/r/EliteDangerous/comments/3on1ib/anyone_interested_in_a_memorial_service_for/,0,Anyone interested in a memorial service for Charlie Manley (Scott Manley's father)?
https://www.reddit.com/r/EliteDangerous/comments/3olife/shield_generator_mass/,3,Shield Generator Mass?
https://www.reddit.com/r/EliteDangerous/comments/3on0bi/can_we_get_a_tldr_about_the_unknown_artifact/,1,Can we get a TL;DR about the Unknown artifact?
https://www.reddit.com/r/EliteDangerous/comments/3omzw1/resource_extraction_site_fps_drops_gpu_usage_drops/,1,Resource Extraction Site FPS drops (GPU usage drops).
https://www.reddit.com/r/EliteDangerous/comments/3omxze/returning_from_months_long_exploration_voyage_no/,1,"Returning from months long exploration voyage, no weapons or shields and terrified of being attacked - suggestions?"
http://imgur.com/UTIKVVJ.jpg,49,The team balancing for CQC is real.
https://www.reddit.com/r/EliteDangerous/comments/3oldpg/mounting_hotas_on_dxracer_chair_armrests/,3,Mounting HOTAS on DXRacer chair armrests?
https://www.reddit.com/r/EliteDangerous/comments/3ojarh/can_we_talk_about_missiles_again/,28,Can we talk about missiles ... again?
https://www.reddit.com/r/EliteDangerous/comments/3omrv9/gnulinux_elite_dangerous_release_date/,0,GNU+Linux Elite Dangerous Release Date?
https://www.reddit.com/r/EliteDangerous/comments/3ok73l/where_is_everybody/,10,Where is everybody?
https://www.reddit.com/r/EliteDangerous/comments/3okngy/t9_pilots_how_have_the_tougher_interdictions/,5,T9 pilots - How have the tougher interdictions affecting your trading?
https://www.reddit.com/r/EliteDangerous/comments/3ommsx/buy_elite_dangerous_now_or_should_i_wait_for/,1,Buy Elite: Dangerous now or should I wait for Horizons?
http://i.imgur.com/Ct3Xwcy.jpg?1,2,They told my power managing the Vulture would be tight
http://i.imgur.com/eVm3KOl.jpg,10,Visiting Proxima Centauri again.
http://imgur.com/6pjre6O,0,"Sure , seems reasonable"
https://www.youtube.com/watch?v=oGhEmI0mY2I,53,Authority
https://www.reddit.com/r/EliteDangerous/comments/3ohlw8/has_anyone_else_noticed_an_increase_in_the_amount/,75,Has anyone else noticed an increase in the amount of time spent in the supercruise/hyperspace transition as of recently?
https://www.youtube.com/watch?v=EvJPyjmfdz0,52,Frontier's development presentation from AWS re:Invent 2015
https://www.reddit.com/r/EliteDangerous/comments/3on9x9/want_to_buy_ed_in_purgatory/,•,Want to buy E:D in purgatory
https://www.reddit.com/r/EliteDangerous/comments/3omaxr/eli5_pledging_allegiances/,1,ELI5: Pledging allegiances.
https://www.reddit.com/r/EliteDangerous/comments/3oi1ld/stats_from_my_3month_exploration_trip/,51,Stats from my 3-Month Exploration Trip
https://www.reddit.com/r/EliteDangerous/comments/3om50z/a_few_more_ships_to_go_before_i_own_1_of_every/,1,A few more ships to go before i own 1 of every ship in the game!
https://www.reddit.com/r/EliteDangerous/comments/3om411/server_just_gone_down_for_me/,1,Server just gone down for me.
https://www.reddit.com/r/EliteDangerous/comments/3ol6j0/hardware_exporting_gameplay_to_the_living_room/,2,"[Hardware] Exporting gameplay to the living room. Recliner + projector + HOTAS, ooh my!"
https://www.reddit.com/r/EliteDangerous/comments/3om33b/how_much_cr_does_give_a_trip_to_sag_a/,1,How much CR does give a trip to Sag A*?
http://i.imgur.com/tI8lq9d.jpg,153,This one is a weird system
https://www.reddit.com/r/EliteDangerous/comments/3oiox0/after_the_storm/,26,After the Storm
http://i.imgur.com/alN8frC.jpg,70,Sidewinder and Vulture.
https://www.reddit.com/r/EliteDangerous/comments/3oko26/flying_without_wings_part_deux/,3,Flying without wings ... part deux
https://www.reddit.com/r/EliteDangerous/comments/3olxln/not_played_this_game_since_a_month_after/,0,Not played this game since a month after release...what has changed?
https://www.youtube.com/watch?v=Akhn6gXnVeQ&feature=youtu.be,1,Typical Сonda-pilot [2].
https://www.reddit.com/r/EliteDangerous/comments/3olvrq/requesting_flightmaneuvering_advice/,0,Requesting flight/maneuvering advice!
https://youtu.be/DgS8JScXikc,37,Latest in empire stealth technology.
https://www.reddit.com/r/EliteDangerous/comments/3oluhe/how_do_i_know_what_system_to_deliver_power_cargo/,0,How do I know what system to deliver power cargo to?
https://www.reddit.com/r/EliteDangerous/comments/3ofudb/ed_made_me_sound_like_a_twat_in_a_business_meeting/,224,ED made me sound like a twat in a business meeting.
https://www.youtube.com/watch?v=Wy3QSe4FW6E,1,Fun in the Diamondback Explorer
https://www.reddit.com/r/EliteDangerous/comments/3olsr0/finally_i_grabbed_it/,0,FINALLY I GRABBED IT
https://www.reddit.com/r/EliteDangerous/comments/3oik51/tsa_in_space/,24,TSA in space!
https://www.reddit.com/r/EliteDangerous/comments/3oln89/does_this_exist_is_there_a_way_to_filter_or/,0,Does this Exist: Is there a way to filter or choose missions based on what your ship is currently capable of? I can't find missions that are doable for my current available ships!
https://www.reddit.com/r/EliteDangerous/comments/3olmyy/hres_res_locations_for_noob_near_zemina_torvals/,1,HRES / RES locations for noob near Zemina Torval's territory
https://www.reddit.com/r/EliteDangerous/comments/3okrdh/asp_or_upgrade_to_type_7_im_mainly_a_tradercourier/,2,ASP or upgrade to Type 7? I'm mainly a trader/courier.
https://www.reddit.com/r/EliteDangerous/comments/3okr3x/new_rank_requirements_for_federation_ships/,2,New rank requirements for Federation Ships
https://www.reddit.com/r/EliteDangerous/comments/3olizp/yet_another_hotas_post_x52_vs_x52_pro/,0,Yet another HOTAS post. X52 vs X52 pro.
https://www.reddit.com/r/EliteDangerous/comments/3okpmb/help_me_new_to_the_game_and_aimlessly_lost/,2,Help me! New to the game and aimlessly lost...
http://imgur.com/rUzjC7H,109,Left behind the work of a dead surveyor - why bringing it home is illegal?
http://i.imgur.com/udVee82.png,3,That was a close catch!
https://www.reddit.com/r/EliteDangerous/comments/3ok0c6/13_hull_on_my_anaconda_177k_repair/,5,13% hull on my Anaconda. 177k repair?
https://www.reddit.com/r/EliteDangerous/comments/3okb4v/got_my_tm_hotas_x_yesterday/,3,Got my TM HOTAS X yesterday...
https://www.reddit.com/r/EliteDangerous/comments/3olbyj/confusion_about_whether_i_need_to_purchase/,1,Confusion About Whether I Need To Purchase Horizons or Not (Beta Backer)
https://www.reddit.com/r/EliteDangerous/comments/3ok2qr/super_new_at_the_game_sowhat_just_happened/,4,Super new at the game. So...what just happened?
https://www.reddit.com/r/EliteDangerous/comments/3ol8or/needing_some_good_federal_advice/,1,Needing some good Federal advice
http://i.imgur.com/v3y7kea.jpg,3,The gas giant was looking rather photogenic.
http://imgur.com/YqimtbP,15,Such is life in the Alcor system
https://www.reddit.com/r/EliteDangerous/comments/3ol6u6/new_shoebox_better_then_the_old_shoebox/,0,New Shoebox Better then the Old Shoebox.
https://www.youtube.com/watch?v=hL7yaG0OeMA,0,Making 1.8 Million In Elite Dangerous In 34 Minutes In The Oculus Dk2
http://puu.sh/kIqHL/6e8a694be1.jpg,5,I think I found where all the naval missions have gone to.
https://www.reddit.com/r/EliteDangerous/comments/3ol011/connection_error/,0,connection error
https://www.reddit.com/r/EliteDangerous/comments/3oia0j/new_profession_idea_the_salvage_operator/,17,New 'profession' idea: The salvage operator.
http://imgur.com/gallery/0JgdwM7,32,How A Conversation Between A Pirate Recruiter & A Non-Willing Should Be
https://www.reddit.com/r/EliteDangerous/comments/3ok2bd/tips_for_exploration/,3,Tips for exploration?
http://i.imgur.com/rTWMUV0.png,5,I'm counting on you! Next random star!
https://www.reddit.com/r/EliteDangerous/comments/3okuos/looking_for_a_good_long_range_smuggling_ship_for/,1,Looking for a good long range smuggling ship for cheap
https://www.youtube.com/watch?v=gUh_VM3SWy0,0,Elite Dangerous episode 5: new ships!
https://www.reddit.com/r/EliteDangerous/comments/3ojyuh/what_ships_are_people_using_for_the_cg_at_noti/,3,What ships are people using for the CG at Noti?
https://www.reddit.com/r/oculus/comments/3ogutb/elite_dangerous_cqc_makes_me_very_very_happy_vr/,0,"Elite: Dangerous CQC makes me very, VERY happy. VR might be an unfair advantage though... • /r/oculus"
https://www.reddit.com/r/EliteDangerous/comments/3oks82/space_station_redecoration/,1,Space Station redecoration!
https://www.reddit.com/r/EliteDangerous/comments/3ok8x8/help_me_break_my_addiction/,2,help me break my addiction
https://www.reddit.com/r/EliteDangerous/comments/3ojo25/has_anyone_read_the_elite_dangerous_books_if_so/,4,Has anyone read the Elite Dangerous books? If so would you recommend?
https://www.reddit.com/r/EliteDangerous/comments/3ojwcd/the_new_interdiction_mechanics_have_made_the_game/,3,The new interdiction mechanics have made the game a lot more challenging and I love it
https://www.reddit.com/r/EliteDangerous/comments/3ojm3d/okay_wth_slow_frame_shift_drive_charge/,4,Okay - wth? Slow frame shift drive charge
https://www.reddit.com/r/EliteDangerous/comments/3ok51j/anacondafdl_vs_fasfg/,2,Anaconda/FdL vs. FAS/FG
https://www.reddit.com/r/EliteDangerous/comments/3okn2u/asp_combat_loadout/,1,asp combat loadout...
https://www.reddit.com/r/EliteDangerous/comments/3okm06/unidentified_signal_source/,1,"""Unidentified Signal Source"""
https://www.reddit.com/r/EliteDangerous/comments/3okkxq/help_me_with_a_smuggling_asp/,1,Help me with a smuggling Asp.
https://community.elitedangerous.com/node/315,24,Community Spotlight: Drew Wagar
https://www.reddit.com/r/EliteDangerous/comments/3ogsiu/important_message_from_the_federal_navy/,28,Important message from the Federal Navy
https://www.reddit.com/r/EliteDangerous/comments/3ojn2y/not_getting_merits_for_anything/,3,Not getting merits for anything
https://www.reddit.com/r/EliteDangerous/comments/3oj1uh/if_i_leave_aislingduval_will_i_have_to_wait/,6,"If I leave Aisling-Duval, will I have to wait another 4 weeks before I can buy prismatics upon rejoining her faction?"
https://www.reddit.com/r/EliteDangerous/comments/3ogm1x/ship_headlights/,32,Ship headlights
https://www.reddit.com/r/EliteDangerous/comments/3ojttc/what_am_i_doing_wrong/,2,What am I doing wrong!?
http://imgur.com/9PLJW98,4,[Bug] Shields showing as offline in SC when they are clearly not.
https://www.reddit.com/r/EliteDangerous/comments/3ojdrw/spawn_on_spare_ships/,3,Spawn on spare ships
http://i.imgur.com/njruG6d.png,10,I heard you like Ship pictures? Thought I'd drop this here
https://www.reddit.com/r/EliteDangerous/comments/3ojrp6/discounted_asp/,2,Discounted Asp?
https://www.reddit.com/r/EliteDangerous/comments/3ojamy/haz_res_are_so_much_fun_i_just_cant_stop_making/,3,haz RES are so much fun!! i just cant stop making money. please help me!
https://www.reddit.com/r/EliteDangerous/comments/3ohvtp/my_fresh_experience_with_elite_dangerous/,9,My fresh experience with Elite: Dangerous.
https://www.youtube.com/watch?v=sfMqbxEWFH4&feature=youtu.be,545,Insane maneuver by auto docking computer!
http://i.imgur.com/9z3NF8E.png,11,Sharing my K&M layout
http://i.imgur.com/hZxxedv.png,4,"If atmospheric landings are added, these are the kind of planets I want to land on."
https://www.youtube.com/watch?v=KHpxojDhYiM,5,20 Million Credits per Hour! OMG! We're all gonna be flying Condas in days.
https://www.reddit.com/r/EliteDangerous/comments/3ojlh5/how_to_earn_merits/,2,How to earn merits?
https://www.reddit.com/r/EliteDangerous/comments/3ok68k/did_14_do_some_tinkering_with_oculus_support/,1,Did 1.4 do some tinkering with oculus support?
https://www.reddit.com/r/EliteDangerous/comments/3ok66l/i_have_a_ship_for_every_occasion/,1,I have a ship for every occasion.
https://www.reddit.com/r/EliteDangerous/comments/3oihi5/who_wants_scanning_effects/,5,Who wants scanning effects?
http://i.imgur.com/GfLJi0V.png,64,Miniatures Game - Almost ready for Fantasticon
https://www.reddit.com/r/EliteDangerous/comments/3ojjs5/should_i_sell_my_type_6_and_vulture_for_an_asp/,2,Should I sell my Type 6 and Vulture for an Asp?
https://www.reddit.com/r/EliteDangerous/comments/3og20s/saved_by_the_fuel_rats/,32,Saved by the fuel rats!
https://www.reddit.com/r/EliteDangerous/comments/3oifmc/been_randomly_dropping_connection_all_night/,5,Been randomly dropping connection all night..
https://www.reddit.com/r/EliteDangerous/comments/3ok3yu/will_elite_rank_allow_me_to_visit_sol/,1,Will Elite rank allow me to visit SOL?
https://www.reddit.com/r/EliteDangerous/comments/3oimfl/discussion_what_music_do_you_listen_to_while/,4,[Discussion] What music do you listen to while playing?
https://www.reddit.com/r/EliteDangerous/comments/3oiyj8/i_want_flicky_switches_for_module_control/,3,I want flicky switches for module control!
https://www.reddit.com/r/EliteDangerous/comments/3ojf4g/securities_been_exploring_a_bit/,2,Securities been exploring a bit...
https://www.reddit.com/r/EliteDangerous/comments/3oibc5/ship_size_class_chart_at_least_i_hope_it_is/,5,Ship size class chart (at least I hope it is)
http://i.imgur.com/5HBZHTi.png,16,1.4 RES in a nutshell
http://www.youtube.com/watch?v=CLGWJykW-BA,0,Lazy PvP. Typical Elite-FDL? Conda vs FDL xD
https://www.reddit.com/r/EliteDangerous/comments/3ogo15/why_are_npcs_so_annoying/,15,Why are NPCs so annoying?
https://community.elitedangerous.com/galnet/12-OCT-3301,7,Feeling sorry for Emperors Dawn.
https://www.reddit.com/r/EliteDangerous/comments/3ojyw6/other_bored_cmdrs/,1,Other bored CMDRs ?
https://youtu.be/0NI_AIiGw2Y,3,Mother of Payouts
https://youtu.be/mMQYOoFZKaY,5,Interdictions in 1.4 summed up in 30 seconds.
https://www.reddit.com/r/EliteDangerous/comments/3ojw57/imperial_cutter_what_do_you_guys_expect_from_this/,2,"Imperial Cutter, what do you guys expect from this sexy ship?"
https://www.reddit.com/r/EliteDangerous/comments/3oi0md/i_keep_overshooting_my_destinations/,5,I keep overshooting my destinations
https://www.reddit.com/r/EliteDangerous/comments/3ofltx/mining_is_really_unfun_with_the_transaction_error/,41,Mining is really unfun with the transaction error
https://www.reddit.com/r/EliteDangerous/comments/3og4ou/psa_dont_accept_multiple_naval_progression/,19,(PSA) don't accept multiple naval progression missions.
https://www.reddit.com/r/EliteDangerous/comments/3ojotm/combat_claim_disappeared/,2,Combat claim disappeared?
https://youtu.be/0wz7A5zpIb0,7,I made an E:D cinematic trailer! What do you guys think of it?
http://imgur.com/q7imvfe,151,"3 tons + 383 light years = 5,127,912 credits"
https://www.reddit.com/r/EliteDangerous/comments/3ogf8f/how_to_post_on_reddit_if_you_are_in_a_pvp_group/,14,How to post on reddit if you are in a PvP group
https://www.reddit.com/r/EliteDangerous/comments/3ohl88/warning_packs_of_vicious_sidewinders_spotted_in/,5,WARNING: Packs of vicious Sidewinders spotted in Federal Space!
https://www.reddit.com/r/EliteDangerous/comments/3ojkmq/bookmarking_systems_and_hangers_for_storing/,0,Bookmarking systems and hangers for storing modules
https://www.reddit.com/r/EliteDangerous/comments/3oh9lj/server_problems_again/,7,Server problems... again?
https://www.reddit.com/r/EliteDangerous/comments/3oi75c/looking_for_wingmates_for_hazres/,3,Looking for wingmates for HazRes
https://www.reddit.com/r/EliteDangerous/comments/3ocsyj/could_we_get_some_more_variety_for_engines_sounds/,412,Could we get some more variety for engines sounds?
https://youtu.be/I8Wq1wXwUKo,3,Time of Chaos (ToC) Diplomatic Mission to The Imperial InQuisition (TIIQ)
https://www.reddit.com/r/EliteDangerous/comments/3oevdq/new_goal_if_i_find_an_an_object_in_my_telescope_i/,61,"New Goal: If I find an an object in my telescope, I have to find it in Elite :) Game ON!"
https://www.reddit.com/r/EliteDangerous/comments/3oif7o/just_spent_an_hour_exploring_with_an_oculus_dk2/,3,Just spent an hour exploring with an Oculus DK2 and a Radeon R390x and maxed settings. I can't even....
https://www.reddit.com/r/EliteDangerous/comments/3oh5ox/what_goals_have_you_set_for_yourself_in_the_game/,5,What goals have you set for yourself in the game?
https://www.reddit.com/r/EliteDangerous/comments/3oie82/is_3_minutes_for_a_warp_normal/,2,Is 3 minutes for a warp normal?
https://www.reddit.com/r/EliteDangerous/comments/3ohuq1/server_down_again_for_me/,4,Server down again for me
http://imgur.com/gallery/Vl2EQ/,190,Need something to read while waiting for servers to be fixed? Check out the v1.4 update to the Emergency Fuel Procedures!
http://i.imgur.com/sbl43km.png,32,Twenty minutes to get from Sol to Hutton? Challenge accepted.
https://www.reddit.com/r/EliteDangerous/comments/3ofg1r/whats_up_with_interdiction/,22,Whats up with interdiction?
https://www.reddit.com/r/EliteDangerous/comments/3ohd3p/black_birds_squadron_introduction/,3,Black Birds Squadron Introduction
https://www.reddit.com/r/EliteDangerous/comments/3ogf3d/have_they_fixed_the_crazy_unplayable_stutter_in/,6,Have they fixed the crazy unplayable stutter in supercruise?
https://www.reddit.com/r/EliteDangerous/comments/3ohumh/long_loading_time_at_start_game/,2,Long loading time at Start Game?
https://youtu.be/F5QkXp-gOI8,6,The Hunt - latest short film - this is also my comp entry. Thanks for watching!
http://imgur.com/ulpyEGa,3,Why's my target square so big?
https://www.reddit.com/r/EliteDangerous/comments/3ohsnb/mining_bug_fixed/,2,Mining bug fixed?
https://www.reddit.com/r/EliteDangerous/comments/3od9as/servers_are_down_for_me_right_now/,164,Servers are down for me right now
https://www.reddit.com/r/EliteDangerous/comments/3oftqn/idea_shields_recharge_faster_but_generate_heat/,10,Idea: Shields recharge faster but generate heat the faster your capacitor drains.
https://www.reddit.com/r/EliteDangerous/comments/3oim4k/kidnapping_new_players_with_trickery_to_join_the/,1,Kidnapping new players with trickery to join the Empire
https://www.reddit.com/r/EliteDangerous/comments/3oh3ot/i_feel_like_im_cheating_on_elite_with_star/,3,I feel like I'm cheating on Elite with Star Citizen. HALP!
https://www.reddit.com/r/EliteDangerous/comments/3og82t/if_you_dont_get_horizons_can_you_play_forever/,6,"If you don't get Horizons, can you play forever?"
https://www.reddit.com/r/EliteDangerous/comments/3oiklk/proof_of_concept_2d_jump_map/,1,"(Proof of concept) 2D ""Jump map"""
https://www.reddit.com/r/EliteDangerous/comments/3oif0s/lots_of_errors_while_mining/,0,Lots of errors while mining?
https://www.reddit.com/r/EliteDangerous/comments/3odgsv/elite_dangerous_server_issues_this_evening/,98,Elite: Dangerous server issues this evening
https://www.reddit.com/r/EliteDangerous/comments/3ogeiu/ongoing_collection_of_news_articles_horizons/,5,"Ongoing collection of news articles: Horizons' ""PlanetReveal"" Raw-Footage Teaser"
https://www.reddit.com/r/EliteDangerous/comments/3oj31l/npcs_spawning_on_your_location_in_massive_numbers/,0,NPC's spawning on your location in massive numbers. Immersion breakus-maximus!
https://www.reddit.com/r/EliteDangerous/comments/3oh9rb/npc_wing_display_glitched/,2,NPC Wing display glitched
https://www.reddit.com/r/EliteDangerous/comments/3oh7ji/empire_rank_and_rep_what_works_for_fast_rep/,2,"Empire Rank and Rep, what works for fast rep griding?"
http://i.imgur.com/BccBCnu.png,112,Yea I think i'm gonna go for the Lottery next
https://www.reddit.com/r/EliteDangerous/comments/3oe3g6/new_profession_suggestion_station_security/,56,New profession suggestion: Station security.
https://www.reddit.com/r/EliteDangerous/comments/3ogasw/which_would_be_the_better_mining_ship/,4,Which would be the better mining ship
https://www.reddit.com/r/EliteDangerous/comments/3oembs/used_the_docking_computer_for_the_first_time_today/,31,Used the Docking Computer for the first time today...
